<?xml version="1.0" encoding="UTF-8"?>

<items xmlns:xsi="http://www.w3.org/2001/XMLSchema-instance"
 xsi:noNamespaceSchemaLocation="items.xsd">
    <item>
        <name>Maricon</name>
        <photo>Maricon</photo>
        <tags>Maricon</tags>
        <diameter>2</diameter>
        <weight>3</weight>
        <price>4.02</price>
        <sizeField>Big</sizeField>
    </item>

    <item>
        <name>Maricon</name>
        <photo>Maricon</photo>
        <tags>Maricon</tags>
        <diameter>2</diameter>
        <weight>3</weight>
        <price>4.01</price>
        <sizeField>Small</sizeField>
    </item>

    <item>
        <name>Maricon</name>
        <photo>Maricon</photo>
        <tags>Maricon</tags>
        <diameter>2</diameter>
        <weight>3</weight>
        <price>4.07</price>
        <sizeField></sizeField>
    </item>
</items>